{
  "authority": "HELD",
  "evidence": "ADAPTED_FROM_ACCEPTED_CANVAS",
  "objects": [
    {
      "authority": "carried from accepted canvas metadata.authority (HELD) — not independently re-derived per node",
      "detail": "Signal",
      "group": "col_00",
      "id": "n1",
      "kind": "canvas_object",
      "label": "Signal",
      "lifecycle_state": "active"
    },
    {
      "authority": "carried from accepted canvas metadata.authority (HELD) — not independently re-derived per node",
      "detail": "Interpretation",
      "group": "col_00",
      "id": "n2",
      "kind": "canvas_object",
      "label": "Interpretation",
      "lifecycle_state": "active"
    },
    {
      "authority": "carried from accepted canvas metadata.authority (HELD) — not independently re-derived per node",
      "detail": "Structuring",
      "group": "col_01",
      "id": "n3",
      "kind": "canvas_object",
      "label": "Structuring",
      "lifecycle_state": "active"
    },
    {
      "authority": "carried from accepted canvas metadata.authority (HELD) — not independently re-derived per node",
      "detail": "Validation",
      "group": "col_02",
      "id": "n4",
      "kind": "canvas_object",
      "label": "Validation",
      "lifecycle_state": "active"
    },
    {
      "authority": "carried from accepted canvas metadata.authority (HELD) — not independently re-derived per node",
      "detail": "Action",
      "group": "col_00",
      "id": "n5",
      "kind": "canvas_object",
      "label": "Action",
      "lifecycle_state": "active"
    },
    {
      "authority": "carried from accepted canvas metadata.authority (HELD) — not independently re-derived per node",
      "detail": "Observation",
      "group": "col_00",
      "id": "n6",
      "kind": "canvas_object",
      "label": "Observation",
      "lifecycle_state": "active"
    },
    {
      "authority": "carried from accepted canvas metadata.authority (HELD) — not independently re-derived per node",
      "detail": "Learning",
      "group": "col_01",
      "id": "n7",
      "kind": "canvas_object",
      "label": "Learning",
      "lifecycle_state": "active"
    },
    {
      "authority": "carried from accepted canvas metadata.authority (HELD) — not independently re-derived per node",
      "detail": "Asset Conversion",
      "group": "col_02",
      "id": "n8",
      "kind": "canvas_object",
      "label": "Asset Conversion",
      "lifecycle_state": "active"
    },
    {
      "authority": "carried from accepted canvas metadata.authority (HELD) — not independently re-derived per node",
      "detail": "Feedback",
      "group": "col_00",
      "id": "n9",
      "kind": "canvas_object",
      "label": "Feedback",
      "lifecycle_state": "active"
    },
    {
      "authority": "carried from accepted canvas metadata.authority (HELD) — not independently re-derived per node",
      "detail": "Gates\nEvidence | PPV | Authority | Risk | STOP/HOLD",
      "group": "col_00",
      "id": "n10",
      "kind": "canvas_object",
      "label": "Gates",
      "lifecycle_state": "active"
    },
    {
      "authority": "carried from accepted canvas metadata.authority (HELD) — not independently re-derived per node",
      "detail": "NAVIGATOR CONTROL / RETURN\nSnapshot: 2026-08-01T23:17:00+10:00\nProjection source: Odoo read-only registers + SharePoint Working Memory + v0.2 correction evidence\nFreshness: Odoo Canonical Library refreshed 2026-08-01; other register counts inherited from verified v0.1 snapshot\nEvidence: SUFFICIENT_FOR_CANDIDATE_REASSURANCE; live-vault route and independent cold-start remain open\nPPV: Potential\nAuthority: HELD — no adoption, runtime, register, canon, Service, Pattern, Method, asset or PPV mutation\nStatus: candidate / static / not current\nReplay-validity: PRESERVED_WITH_CONDITIONS\nReturn: [[NAVIGATOR_MVP_PRIMARY_HOME_CANDIDATE_v0.2]]",
      "group": "col_00",
      "id": "control_v02",
      "kind": "control_return_block",
      "label": "NAVIGATOR CONTROL / RETURN",
      "lifecycle_state": "held"
    }
  ],
  "ppv": "Potential",
  "reality": "CANDIDATE_REGENERATION — the accepted canvas at Obsidian/10_WORKSPACES/NAVIGATOR_MVP_v0.2/05_MESH_LIFECYCLE_GATES.canvas remains the current filed version and is UNCHANGED by this build; this is a compiler-regenerated candidate rendering of the same node/edge content through the SCVS-integrated compiler, not a replacement",
  "relationships": [
    {
      "from": "n1",
      "id": "e1",
      "to": "n2",
      "verb": "relates_to"
    },
    {
      "from": "n2",
      "id": "e2",
      "to": "n3",
      "verb": "relates_to"
    },
    {
      "from": "n3",
      "id": "e3",
      "to": "n4",
      "verb": "relates_to"
    },
    {
      "from": "n4",
      "id": "e4",
      "to": "n5",
      "verb": "D001/D007 where required"
    },
    {
      "from": "n5",
      "id": "e5",
      "to": "n6",
      "verb": "relates_to"
    },
    {
      "from": "n6",
      "id": "e6",
      "to": "n7",
      "verb": "relates_to"
    },
    {
      "from": "n7",
      "id": "e7",
      "to": "n8",
      "verb": "AQG"
    },
    {
      "from": "n8",
      "id": "e8",
      "to": "n9",
      "verb": "relates_to"
    },
    {
      "from": "n9",
      "id": "e9",
      "to": "n1",
      "verb": "relates_to"
    },
    {
      "from": "n10",
      "id": "e10",
      "to": "n4",
      "verb": "controls"
    },
    {
      "from": "n10",
      "id": "e11",
      "to": "n5",
      "verb": "controls"
    }
  ],
  "return_route": "05_AI_RETURNS_HASHED/WO-NAVIGATOR-MVP-INTEGRATION-AND-VISUAL-COMPLETION-001/WAVE_INTEGRATED_NAVIGATOR_MVP_20260802/OVERNIGHT_STREAM_B_OUTPUT_v0.1/SYNAPSYS_NAVIGATOR_MVP_ARCHITECTURE_v1.3_CANDIDATE.html",
  "snapshot": "2026-08-01T16:48:19Z",
  "source": "adapted from accepted canvas Obsidian/10_WORKSPACES/NAVIGATOR_MVP_v0.2/05_MESH_LIFECYCLE_GATES.canvas (read live via sp_read this session; original snapshot 2026-08-01T23:17:00+10:00)",
  "title": "Mesh Lifecycle and Gates (candidate regeneration)",
  "view_id": "05_mesh_lifecycle_gates"
}
