{
  "authority": "HELD",
  "evidence": "ADAPTED_FROM_ACCEPTED_CANVAS",
  "objects": [
    {
      "authority": "carried from accepted canvas metadata.authority (HELD) — not independently re-derived per node",
      "detail": "Navigator Home\n[[NAVIGATOR_MVP_PRIMARY_HOME_CANDIDATE_v0.2]]",
      "group": "col_00",
      "id": "n1",
      "kind": "canvas_object",
      "label": "Navigator Home",
      "lifecycle_state": "candidate"
    },
    {
      "authority": "carried from accepted canvas metadata.authority (HELD) — not independently re-derived per node",
      "detail": "Services\n[[SERVICE_CATALOGUE_PROJECTION_v0.2]]",
      "group": "col_00",
      "id": "n2",
      "kind": "canvas_object",
      "label": "Services",
      "lifecycle_state": "active"
    },
    {
      "authority": "carried from accepted canvas metadata.authority (HELD) — not independently re-derived per node",
      "detail": "Patterns\n[[PATTERN_LIBRARY_PROJECTION_v0.1]]",
      "group": "col_01",
      "id": "n3",
      "kind": "canvas_object",
      "label": "Patterns",
      "lifecycle_state": "active"
    },
    {
      "authority": "carried from accepted canvas metadata.authority (HELD) — not independently re-derived per node",
      "detail": "Methods\n[[METHOD_LIBRARY_PROJECTION_v0.2]]",
      "group": "col_02",
      "id": "n4",
      "kind": "canvas_object",
      "label": "Methods",
      "lifecycle_state": "active"
    },
    {
      "authority": "carried from accepted canvas metadata.authority (HELD) — not independently re-derived per node",
      "detail": "Canonical\n[[CANONICAL_LIBRARY_PROJECTION_v0.2]]",
      "group": "col_00",
      "id": "n5",
      "kind": "canvas_object",
      "label": "Canonical",
      "lifecycle_state": "active"
    },
    {
      "authority": "carried from accepted canvas metadata.authority (HELD) — not independently re-derived per node",
      "detail": "Benefits / Assets\n[[BENEFIT_ASSET_PROJECTION_v0.1]]",
      "group": "col_00",
      "id": "n6",
      "kind": "canvas_object",
      "label": "Benefits / Assets",
      "lifecycle_state": "active"
    },
    {
      "authority": "carried from accepted canvas metadata.authority (HELD) — not independently re-derived per node",
      "detail": "Context / Work Object\n[[CONTEXT_WORK_OBJECT_PROJECTION_v0.1]]",
      "group": "col_01",
      "id": "n7",
      "kind": "canvas_object",
      "label": "Context / Work Object",
      "lifecycle_state": "active"
    },
    {
      "authority": "carried from accepted canvas metadata.authority (HELD) — not independently re-derived per node",
      "detail": "Dashboard\nNAVIGATOR_MVP_PRIMARY_DASHBOARD_CANDIDATE_v0.2.html",
      "group": "col_02",
      "id": "n8",
      "kind": "canvas_object",
      "label": "Dashboard",
      "lifecycle_state": "candidate"
    },
    {
      "authority": "carried from accepted canvas metadata.authority (HELD) — not independently re-derived per node",
      "detail": "NAVIGATOR CONTROL / RETURN\nSnapshot: 2026-08-01T23:17:00+10:00\nProjection source: Odoo read-only registers + SharePoint Working Memory + v0.2 correction evidence\nFreshness: Odoo Canonical Library refreshed 2026-08-01; other register counts inherited from verified v0.1 snapshot\nEvidence: SUFFICIENT_FOR_CANDIDATE_REASSURANCE; live-vault route and independent cold-start remain open\nPPV: Potential\nAuthority: HELD — no adoption, runtime, register, canon, Service, Pattern, Method, asset or PPV mutation\nStatus: candidate / static / not current\nReplay-validity: PRESERVED_WITH_CONDITIONS\nReturn: [[NAVIGATOR_MVP_PRIMARY_HOME_CANDIDATE_v0.2]]",
      "group": "col_00",
      "id": "control_v02",
      "kind": "control_return_block",
      "label": "NAVIGATOR CONTROL / RETURN",
      "lifecycle_state": "held"
    }
  ],
  "ppv": "Potential",
  "reality": "CANDIDATE_REGENERATION — the accepted canvas at Obsidian/10_WORKSPACES/NAVIGATOR_MVP_v0.2/15_INTEGRATED_DRILLDOWN_RETURN.canvas remains the current filed version and is UNCHANGED by this build; this is a compiler-regenerated candidate rendering of the same node/edge content through the SCVS-integrated compiler, not a replacement",
  "relationships": [
    {
      "from": "n1",
      "id": "e1",
      "to": "n2",
      "verb": "drill"
    },
    {
      "from": "n1",
      "id": "e2",
      "to": "n3",
      "verb": "drill"
    },
    {
      "from": "n1",
      "id": "e3",
      "to": "n4",
      "verb": "drill"
    },
    {
      "from": "n1",
      "id": "e4",
      "to": "n5",
      "verb": "drill"
    },
    {
      "from": "n1",
      "id": "e5",
      "to": "n6",
      "verb": "drill"
    },
    {
      "from": "n1",
      "id": "e6",
      "to": "n7",
      "verb": "drill"
    },
    {
      "from": "n1",
      "id": "e7",
      "to": "n8",
      "verb": "open"
    },
    {
      "from": "n2",
      "id": "e8",
      "to": "n1",
      "verb": "return"
    },
    {
      "from": "n3",
      "id": "e9",
      "to": "n1",
      "verb": "return"
    },
    {
      "from": "n4",
      "id": "e10",
      "to": "n1",
      "verb": "return"
    },
    {
      "from": "n5",
      "id": "e11",
      "to": "n1",
      "verb": "return"
    },
    {
      "from": "n6",
      "id": "e12",
      "to": "n1",
      "verb": "return"
    },
    {
      "from": "n7",
      "id": "e13",
      "to": "n1",
      "verb": "return"
    }
  ],
  "return_route": "05_AI_RETURNS_HASHED/WO-NAVIGATOR-MVP-INTEGRATION-AND-VISUAL-COMPLETION-001/WAVE_INTEGRATED_NAVIGATOR_MVP_20260802/OVERNIGHT_STREAM_B_OUTPUT_v0.1/SYNAPSYS_NAVIGATOR_MVP_ARCHITECTURE_v1.3_CANDIDATE.html",
  "snapshot": "2026-08-01T16:48:19Z",
  "source": "adapted from accepted canvas Obsidian/10_WORKSPACES/NAVIGATOR_MVP_v0.2/15_INTEGRATED_DRILLDOWN_RETURN.canvas (read live via sp_read this session; original snapshot 2026-08-01T23:17:00+10:00)",
  "title": "Integrated Drill-down and Return (candidate regeneration)",
  "view_id": "15_integrated_drilldown_return"
}
